<?xml version="1.0" encoding="UTF-8"?>
<!DOCTYPE catalog SYSTEM "Pastry shop.dtd">

<!-- PASTRY SHOP -->

<catalog>
    <cakes>
        <cake id = 'C1'>                      
            <name>Мираж</name>
            <category type = 'Шоколадова'/>
            <price currency = 'Лев'>28</price>
            <available>2</available>
            <piece>16</piece>
            <weight weight = 'кг'>1.8</weight>
            <products>           
                <product number = 'P1'>Захар</product>    
                <product number = 'P7'>Брашно</product>
                <product number = 'P14'>Вода</product>
                <product number = 'P6'>Прясно мляко</product>
                <product number = 'P36'>Натурален шоколад</product>
            </products>   
            <expiryDate date = 'Дни'>10</expiryDate>   
            <storage>В хладилник</storage>
            <description><![CDATA[ 
                Шоколадова сметана с какаови платки, обвити в плътен течен шоколад.  
                ]]>
            </description> 
            <image>http://www.chochko.com/shop/стандартни/торта-мираж/</image>
        </cake>  
        
        <cake id = 'C4'>
            <name>Еклерова</name>
            <category type = 'Млечна'/>   
            <price currency = 'Лев'>32</price>
            <available>1</available>
            <piece>16</piece>
            <weight weight = 'кг'>2.1</weight>
            <products>           
                <product number = 'P1'>Захар</product>    
                <product number = 'P7'>Брашно</product>
                <product number = 'P14'>Вода</product>
                <product number = 'P6'>Прясно мляко</product>
                <product number = 'P61'>Сметана</product>
                <product number = 'P37'>Млечен шоколад</product>
                <product number = 'P107'>Фъстъци</product>
            </products>   
            <expiryDate date = 'Дни'>8</expiryDate>   
            <storage>В хладилник</storage>
            <description><![CDATA[ 
                Ароматно изкушение от млечен крем с мини еклери и млечен шоколад, 
                бели пандишпанови платки, украсена с бял шоколад и парченца фъстъци.  
                ]]>
            </description> 
            <image>http://www.chochko.com/shop/стандартни/торта-еклерова-2/</image>
        </cake>    
    </cakes>
    
    <candies>
        <candy>
            <name>Трюфел</name>
            <price currency = 'Лев'>11.20</price>
            <expiryDate date = 'Дни'>20</expiryDate>
        </candy>
        
        <candy>
            <name>Кокосови бонбони</name>
            <price currency = 'Лев'>9.90</price>
            <expiryDate date = 'Дни'>20</expiryDate>
        </candy>
    </candies>  
    
    <cookies>
        <cookie>
            <name>Ореховки</name>
            <price currency = 'Лев'>1.10</price>
            <quantity quantity = 'Брой'>1</quantity>
            <products>           
                <product number = 'P1'>Захар</product>    
                <product number = 'P7'>Брашно</product>
                <product number = 'P113'>Орехи</product>
            </products>  
        </cookie>
        
        <cookie>
            <name>Пълнозърнести бисквити</name>
            <price currency = 'Лев'>1.40</price>
            <quantity quantity = 'Брой'>1</quantity>
            <products>           
                <product number = 'P1'>Захар</product>    
                <product number = 'P8'>Пълнозърнесто брашно</product>
                <product number = 'P114'>Бадеми</product>
                <product number = 'P129'>Тиквени семки</product>
                <product number = 'P147'>Сусам</product>
                <product number = 'P151'>Ленено семе</product>
            </products>  
        </cookie>
    </cookies>
    
    <creams>
        <cream>
            <type>Шоколадов</type>
            <price currency = 'Лев'>3</price>
            <quantity quantity = 'Мл'>250</quantity>
        </cream>
        
        <cream>
            <type>Яйчен</type>
            <price currency = 'Лев'>2.80</price>
            <quantity quantity = 'Мл'>220</quantity>
        </cream>
    </creams>
    
</catalog>
